ID	Type	SKU	Name	Published	Is featured?	Visibility in catalog	Short description	Description	Date sale price starts	Date sale price ends	Tax status	Tax class	In stock?	Stock	Backorders allowed?	Sold individually?	Weight (lbs)	Length (in)	Width (in)	Height (in)	Allow customer reviews?	Purchase note	Sale price	Regular price	Categories	Tags	Shipping class	Images	Download limit	Download expiry days	Parent	Grouped products	Upsells	Cross-sells	External URL	Button text	Position	Attribute 1 name	Attribute 1 value(s)	Attribute 1 visible	Attribute 1 global	Attribute 2 name	Attribute 2 value(s)	Attribute 2 visible	Attribute 2 global	Meta: _wpcom_is_markdown	Download 1 name	Download 1 URL	Download 2 name	Download 2 URL
	simple		Paski na rzep do potników STANDARD - Eskadron - black	1	0	visible		Paski na rzep do potników STANDARD - Eskadron - blackWymienne paski do potników.Zapinane na mocny rzep.Cena za parê.Kolor: czarny					1				0							11.00	Dla konia > Potniki, podk³adki pod siod³o > Czapraki, potniki			https://static5.redcart.pl/templates/images/thumb/22951/1500/1500/pl/0/templates/images/products/22951/09be2349ceebd9bdd36a87caebc89047.jpg																
	simple		Worek do prania ochraniaczy - ESKADRON	1	0	visible		Worek do prania ochraniaczy - ESKADRONIdealna ochrona ochraniaczy i banda¿y podczas prania.Kolor: czarny					1				0							22.00	Dla konia > Ochraniacze, kaloszki, owijki i podk³adki			https://static5.redcart.pl/templates/images/thumb/22951/1500/1500/pl/0/templates/images/products/22951/b280d9c6b973dd25bd947cc51d0beb34.jpg																
	simple		Kolanówki Eskadron EQUESTRIAN FANATICS SS 2019 - animal print	1	0	visible		"Kolanówki Eskadron EQUESTRIAN FANATICS SS 2019 - animal printZdobione printem w cêtki oraz napisem ""Eskadron"".Elastyczne oraz oddychaj¹ce.Kolor: animal printEdycja limitowana!!"					1				0							39.00	Dla jeŸdŸca > Odzie¿ jeŸdziecka > Podkolanówki, skarpetki			https://static1.redcart.pl/templates/images/thumb/22951/1500/1500/pl/0/templates/images/products/22951/a65491dbf7bdb8e9df2cda116beec345.jpg																
	simple		Uwi¹z Eskadron DURAL ELASTIC CLASSIC SPORTS wiosna-lato 2017 - midgreen/white/ pepperred/navy	1	0	visible		Uwi¹z wykonany z elastycznej, plecionej linki.D³ugoœæ: 2mKarabiñczyk:SNAP (zwyk³y)PANIC (bezpieczny)Kolor:midgreen/white/pepperred/navy					1				0							49.00	Dla konia > Kantary, uwi¹zy > Uwi¹zy			https://static1.redcart.pl/templates/images/thumb/22951/1500/1500/pl/0/templates/images/products/22951/d11173c7f6dade10ffb49c4ef02bcf49.jpg																
	simple		Uwi¹z DICK Eskadron NEXT GENERATION wiosna-lato 2017	1	0	visible		Aloha! Nowa kolekcja Eskadron Next Generation wiosna-lato 2017 ju¿ dostêpna!Kolor:smokedblue/white/grenadine (go³êbi szary/bia³y/pomidorowy)Uwi¹z wykonany z grubszej plecionej linki polipropylowej ni¿ standardowo w uwi¹zach eskadron.Karabiñczyk:SNAP (zwyk³y)D³ugoœæ: 2m					1				0							49.00	Dla konia > Kantary, uwi¹zy > Uwi¹zy			https://static2.redcart.pl/templates/images/thumb/22951/1500/1500/pl/0/templates/images/products/22951/b51ce11ae1d995d870912438873c48a6.jpg																
	simple		Uwi¹z Eskadron DURALASTIC NICI 2017/18 - PANIC	1	0	visible		Uwi¹z wykonany z elastycznej, plecionej linki. Karabiñczyk bezpieczny w kolorze srebrnym.D³ugoœæ: 2mKarabiñczyk:PANIC (bezpieczny)SNAPKolor:szary/morela/intensywny ró¿/bia³y					1				0							49.00	Dla konia > Kantary, uwi¹zy > Uwi¹zy			https://static3.redcart.pl/templates/images/thumb/22951/1500/1500/pl/0/templates/images/products/22951/abe76477c8500736aef3feaa472b6fd3.jpg																
	simple		Uwi¹z Eskadron Classic Sports wiosna-lato 2019 panic - fusion coral/blanc/seapine green	1	0	visible		Uwi¹z wykonany z plecionej linki polipropylowej. Karabiñczyk w kolorze srebrnym.D³ugoœæ: 2mKarabiñczyk:PANIC (bezpieczny)Kolor:fusion coral/blanc/seapine green (koralowy/kremowy/morska zieleñ)					1				0							49.00	Dla konia > Kantary, uwi¹zy > Uwi¹zy			https://static3.redcart.pl/templates/images/thumb/22951/1500/1500/pl/0/templates/images/products/22951/d6d6a8b92e0ab6f9740c9e6435e8ac06.jpg																
	simple		Kolanówki Equestrian Fanatics - Eskadron - navy blue	1	0	visible		Kolanówki Equestrian Fanatics - EskadronKlasyczne kolanówki jeŸdzieckie.Wykonane z elastycznej bawe³ny.Na ³ydce napis RIDE.EAT.SLEEP.REPEAT.Kolor: navy blue					1				0							42.00	Dla jeŸdŸca > Odzie¿ jeŸdziecka > Podkolanówki, skarpetki			https://static1.redcart.pl/templates/images/thumb/22951/1500/1500/pl/0/templates/images/products/22951/bf3cd234dadbeb71afa739d70dc158cf.jpg																
	simple		Uwi¹z Eskadron DURALASTIC Classic Sports wiosna-lato 2019 panic - seapine green	1	0	visible		Uwi¹z wykonany z elastycznej, plecionej linki. Karabiñczyk bezpieczny w kolorze srebrnym.D³ugoœæ: 2mKarabiñczyk:PANIC (bezpieczny)Kolor:seapine green (morska zieleñ/krem/granat/koral)					1				0							53.00	Dla konia > Kantary, uwi¹zy > Uwi¹zy			https://static2.redcart.pl/templates/images/thumb/22951/1500/1500/pl/0/templates/images/products/22951/eeda1c90249d6a21b643bbb575f89694.jpg																
	simple		Opaska odblaskowa Eskadron Reflexx wiosna/lato 2020 - light grey	1	0	visible		Opaska odblaskowa Eskadron Reflexx wiosna/lato 2020 - light greyModna opaska odblaskowa. Samozaciskowa, idealnie dopasuje siê do r¹k i nóg. Ozdobiona logiem firmy. Wygodna w noszeniu. Pomo¿e zapewniæ bezpieczeñstwo przy jeŸdzie po ciemku/wyjazdach w tereny. Kolor: jasny szary 					1				0							43.00	Kolekcje > ESKADRON Kolekcje			https://static1.redcart.pl/templates/images/thumb/22951/1500/1500/pl/0/templates/images/products/22951/67384e7c1048d8ff24898c18c770973f.png																
	simple		Uwi¹z Eskadron LIMITED - PANIC 	1	0	visible		Kolory:ró¿/granat (pink-navy)turkus/antracyt (baltic-anthra)granat/fioletowo-szary (denim)Uwi¹z z limitowanej kolekcji wykonany z plecionej linki polipropylowej zakoñczony karabiñczykiem typu PANIC (bezpieczny).D³ugoœæ: 2m					1				0							45.00	Dla konia > Kantary, uwi¹zy > Uwi¹zy			https://static1.redcart.pl/templates/images/thumb/22951/1500/1500/pl/0/templates/images/products/22951/52ef6da3a955a2a90601bdc69feddcfb.jpg																
	simple		Uwi¹z Eskadron Classic Sports wiosna-lato 2019 panic - navy/blanc/fusion coral	1	0	visible		Uwi¹z wykonany z plecionej linki polipropylowej. Karabiñczyk w kolorze srebrnym.D³ugoœæ: 2mKarabiñczyk:PANIC (bezpieczny)Kolor:navy/blanc/fusion coral (granat/krem/koralowy)					1				0							49.00	Dla konia > Kantary, uwi¹zy > Uwi¹zy			https://static4.redcart.pl/templates/images/thumb/22951/1500/1500/pl/0/templates/images/products/22951/aa6fbb571127cbf7e14ab1e3dcc244f3.jpg																
	simple		Uwi¹z Eskadron DURALASTIC - PLATINUM 2019/2020 - PANIC - offwhite/vermillion-orange/beige/martini-olive/navy	1	0	visible		Uwi¹z Eskadron DURALASTIC - PLATINUM 2019/2020 - PANICUwi¹z wykonany z elastycznej, plecionej linki. Karabiñczyk bezpieczny w kolorze srebrnym.Kolor: offwhite/vermillion-orange/beige/martini-olive/navy					1				0							49.00	Dla konia > Kantary, uwi¹zy > Uwi¹zy			https://static1.redcart.pl/templates/images/thumb/22951/1500/1500/pl/0/templates/images/products/22951/3a7003753d276b1123cec7c5f5444832.png																
	simple		Uwi¹z Eskadron DURALASTIC - PLATINUM 2019/2020 - SNAP - offwhite/vermillion-orange/beige/martini-olive/navy	1	0	visible		Uwi¹z Eskadron DURALASTIC - PLATINUM 2019/2020 - SNAPUwi¹z wykonany z elastycznej, plecionej linki. Karabiñczyk zwyk³y w kolorze srebrnym.Kolor: offwhite/vermillion-orange/beige/martini-olive/navy					1				0							49.00	Dla konia > Kantary, uwi¹zy > Uwi¹zy			https://static3.redcart.pl/templates/images/thumb/22951/1500/1500/pl/0/templates/images/products/22951/0687961c83761094bf31e15406635beb.png																
	simple		Uwi¹z Eskadron DURALASTIC SNAP Reflexx wiosna/lato 2020 - neon/reflective/navy	1	0	visible		Uwi¹z Eskadron DURALASTIC Reflexx wiosna/lato 2020 - neon/reflective/navyUwi¹z jest wykonany z wytrzyma³ej, plecionej linki. Posiada zwyk³y karabiñczyk w kolorze srebrnym. Kolor: neon/reflective/navy					1				0							49.00	Dla konia > Kantary, uwi¹zy > Uwi¹zy			https://static4.redcart.pl/templates/images/thumb/22951/1500/1500/pl/0/templates/images/products/22951/6393711ac4a7347acc8fd2e5369c68ca.png																
	simple		Uwi¹z PANIC STANDARD - Eskadron - ice/white/stone	1	0	visible		Uwi¹z PANIC STANDARD - Eskadron - ice/white/stoneWykonany z plecionej linki polipropylenowej.Z niklowanym, bezpiecznym karabiñczykiem.D³ugoœæ: 2mKolor: ice/white/stone - miêtowy/bia³y/szary					1				0							52.00	Dla konia > Kantary, uwi¹zy > Uwi¹zy			https://static2.redcart.pl/templates/images/thumb/22951/1500/1500/pl/0/templates/images/products/22951/2608f4aa81254d8e228fbf874e5b5b24.jpg																
	simple		Uwi¹z PANIC STANDARD - Eskadron - blackberry	1	0	visible		Uwi¹z PANIC STANDARD - Eskadron - blackberryWykonany z plecionej linki polipropylenowej.Z niklowanym, bezpiecznym karabiñczykiem.D³ugoœæ: 2mKolor: blackberry - je¿ynowy					1				0							52.00	Dla konia > Kantary, uwi¹zy > Uwi¹zy			https://static4.redcart.pl/templates/images/thumb/22951/1500/1500/pl/0/templates/images/products/22951/b3e5ee55419c53f8ac2be60371db39d3.jpg																
	simple		Uwi¹z PANIC HOOK STANDARD - Eskadron - racinggreen	1	0	visible		Uwi¹z PANIC HOOK STANDARD - EskadronPleciony uwi¹z, wykonany z mocnej linki.Z bezpiecznym karabiñczykiem.D³ugoœæ: 2mKolor: racinggreen					1				0							52.00	Dla konia > Kantary, uwi¹zy > Uwi¹zy			https://static4.redcart.pl/templates/images/thumb/22951/1500/1500/pl/0/templates/images/products/22951/874bc9991aadea9ef7069ecc7a08494a.jpg																
	simple		Uwi¹z PANIC STANDARD - Eskadron - chili/white/nightblue	1	0	visible		Uwi¹z PANIC STANDARD - EskadronWykonany z plecionej linki polipropylenowej.Z niklowanym, bezpiecznym karabiñczykiem.D³ugoœæ: 2mKolor: chili/white/nightblue - czerwony/bia³y/granatowy					1				0							52.00	Dla konia > Kantary, uwi¹zy > Uwi¹zy			https://static4.redcart.pl/templates/images/thumb/22951/1500/1500/pl/0/templates/images/products/22951/b8ba851713be6041f8a6a10e778c2569.jpg																
	simple		Uwi¹z PANIC STANDARD - Eskadron - nightblue/white/blackberry	1	0	visible		Uwi¹z PANIC STANDARD - EskadronWykonany z plecionej linki polipropylenowej.Z niklowanym, bezpiecznym karabiñczykiem.D³ugoœæ: 2mKolor: nightblue/white/blackberry - granatowy/bia³y/je¿ynowy					1				0							52.00	Dla konia > Kantary, uwi¹zy > Uwi¹zy			https://static3.redcart.pl/templates/images/thumb/22951/1500/1500/pl/0/templates/images/products/22951/c5babe822393892680e6e6617bcfb512.jpg																
	simple		Uwi¹z SWIVEL HOOK STANDARD - Eskadron - ice/white/stone	1	0	visible		Uwi¹z SWIVEL HOOK STANDARD - EskadronPleciony uwi¹z, wykonany z mocnej linki.Ze zwyk³ym karabiñczykiem.D³ugoœæ: 2mKolor: ice/white/stone					1				0							53.00	Dla konia > Kantary, uwi¹zy > Uwi¹zy			https://static2.redcart.pl/templates/images/thumb/22951/1500/1500/pl/0/templates/images/products/22951/df0b3541b1cd31005679d2eac35d1464.jpg																
	simple		Uwi¹z SWIVEL HOOK STANDARD - Eskadron - racinggreen	1	0	visible		Uwi¹z SWIVEL HOOK STANDARD - EskadronPleciony uwi¹z, wykonany z mocnej linki.Ze zwyk³ym karabiñczykiem.D³ugoœæ: 2mKolor: racinggreen					1				0							53.00	Dla konia > Kantary, uwi¹zy > Uwi¹zy			https://static3.redcart.pl/templates/images/thumb/22951/1500/1500/pl/0/templates/images/products/22951/38cb3a21e76e2f7d3cc064b129d3b516.jpg																
	simple		Uwi¹z SWIVEL HOOK STANDARD - Eskadron - chili/white/night blue	1	0	visible		Uwi¹z SWIVEL HOOK STANDARD - EskadronPleciony uwi¹z, wykonany z mocnej linki.Ze zwyk³ym karabiñczykiem.D³ugoœæ: 2mKolor: chili/white/night blue					1				0							53.00	Dla konia > Kantary, uwi¹zy > Uwi¹zy			https://static4.redcart.pl/templates/images/thumb/22951/1500/1500/pl/0/templates/images/products/22951/09251b7d156f5cf052b33bb80975a3c6.jpg																
	simple		Uwi¹z SWIVEL HOOK STANDARD - Eskadron - nightblue/white/blackberry	1	0	visible		Uwi¹z SWIVEL HOOK STANDARD - EskadronPleciony uwi¹z, wykonany z mocnej linki.Ze zwyk³ym karabiñczykiem.D³ugoœæ: 2mKolor: nightblue/white/blackberry					1				0							53.00	Dla konia > Kantary, uwi¹zy > Uwi¹zy			https://static4.redcart.pl/templates/images/thumb/22951/1500/1500/pl/0/templates/images/products/22951/a114c9491b51f05a05ebd47bd5d36ee2.jpg																
	simple		Uwi¹z SWIVEL HOOK STANDARD - Eskadron - blackberry	1	0	visible		Uwi¹z SWIVEL HOOK STANDARD - EskadronPleciony uwi¹z, wykonany z mocnej linki.Ze zwyk³ym karabiñczykiem.D³ugoœæ: 2mKolor: blackberry					1				0							53.00	Dla konia > Kantary, uwi¹zy > Uwi¹zy			https://static3.redcart.pl/templates/images/thumb/22951/1500/1500/pl/0/templates/images/products/22951/f42f6cc6c48dac2bcc96d5e56f7ae875.jpg																
	simple		Uwi¹z SWIVEL HOOK STANDARD - Eskadron - black	1	0	visible		Uwi¹z SWIVEL HOOK STANDARD - Eskadron - blackPleciony uwi¹z, wykonany z mocnej linki.Ze zwyk³ym karabiñczykiem.D³ugoœæ: 2mKolor: black					1				0							53.00	Dla konia > Kantary, uwi¹zy > Uwi¹zy			https://static1.redcart.pl/templates/images/thumb/22951/1500/1500/pl/0/templates/images/products/22951/c71657b0fa8e9e9595895065299b6672.jpg																
	simple		Uwi¹z SWIVEL HOOK STANDARD - Eskadron - nightblue	1	0	visible		Uwi¹z SWIVEL HOOK STANDARD - Eskadron - nightbluePleciony uwi¹z, wykonany z mocnej linki.Ze zwyk³ym karabiñczykiem.D³ugoœæ: 2mKolor: nightblue					1				0							53.00	Dla konia > Kantary, uwi¹zy > Uwi¹zy			https://static4.redcart.pl/templates/images/thumb/22951/1500/1500/pl/0/templates/images/products/22951/3c329129317f26e792f7b28a48ed9d90.jpg																
	simple		Ocieplacze na d³onie/nadgarstki we³niane - Eskadron - blackberry	1	0	visible		Ocieplacze na d³onie/nadgarstki we³niane - EskadronWykonane z mi³ej w dotyku we³ny.Mog¹ byæ u¿ywane razem z rêkawiczkami.Idealne na mroŸne dni.Wykoñczone œci¹gaczami.Materia³: 100% we³naRozmiar: ONE SIZEKolor: blackberry					1				0							89.00	Dla jeŸdŸca > Odzie¿ jeŸdziecka > Rêkawiczki			https://static4.redcart.pl/templates/images/thumb/22951/1500/1500/pl/0/templates/images/products/22951/65ccaa9299c477820e2355a948891cab.jpg																
	simple		P³yn do prania wyrobów z owczego futra Lammfell Wash - ESKADRON	1	0	visible		P³yn do prania wyrobów z owczego futra Lammfell Wash.Sposób u¿ycia: Nale¿y wlaæ jedn¹ nakrêtkê p³ynu do pralki lub pó³ nakrêtki w przypadku prania rêcznego. Detergent stosuje siê zamiast tradycyjnych proszków do prania.Pojemnoœæ: 500 ml					1				0							55.00	Siod³a i osprzêt > Œrodki do konserwacji			https://static2.redcart.pl/templates/images/thumb/22951/1500/1500/pl/0/templates/images/products/22951/18bdf9b8058f9972268cc13c9136a6bf.jpg																
	simple		Uwi¹z REGULAR SWIVEL - PLATINUM EDITION 2020/21 - Eskadron - havanabrown/greige/light taupe	1	0	visible		Uwi¹z REGULAR SWIVEL - PLATINUM EDITION 2020/21 - EskadronWykonany z mocnej, elastycznej linki polipropylenowej.Ze zwyk³ym karabiñczykiem.D³ugoœæ: 2mKolor: havanabrown/greige/light taupe					1				0							55.00	Dla konia > Kantary, uwi¹zy > Uwi¹zy			https://static3.redcart.pl/templates/images/thumb/22951/1500/1500/pl/0/templates/images/products/22951/0efceb02cf4b481eab5f7f5f7bd0fb8c.png																
	simple		Uwi¹z PANIC - CLASSIC SPORTS wiosna-lato 2021 - Eskadron - navy/cream/tendertaupe 	1	0	visible		Uwi¹z PANIC - CLASSIC SPORTS wiosna-lato 2021 - EskadronWykonany z mocnej linki polipropylenowej.Z bezpiecznym karabiñczykiem.D³ugoœæ: 2mKolor: navy/cream/tendertaupe					1				0							55.00	Dla konia > Kantary, uwi¹zy > Uwi¹zy			https://static5.redcart.pl/templates/images/thumb/22951/1500/1500/pl/0/templates/images/products/22951/9ccf0fe8f707c8b53a664cae1d871da8.png																
	simple		Uwi¹z REGULAR - CLASSIC SPORTS wiosna-lato 2021 - Eskadron - navy/cream/tendertaupe	1	0	visible		Uwi¹z REGULAR - CLASSIC SPORTS wiosna-lato 2021 - EskadronWykonany z mocnej linki polipropylenowej.Ze zwyk³ym karabiñczykiem.D³ugoœæ: 2mKolor: navy/cream/tendertaupe					1				0							55.00	Dla konia > Kantary, uwi¹zy > Uwi¹zy			https://static1.redcart.pl/templates/images/thumb/22951/1500/1500/pl/0/templates/images/products/22951/eeedab300f305b0edbabef8e7154add0.png																
	simple		Uwi¹z PANIC - Reflexx S/S 21 - Eskadron - black-white-lightolive	1	0	visible		Uwi¹z PANIC - Reflexx S/S 21 - EskadronWykonany z mocnej, trzykolorowej linki polipropylenowej.Okucia w kolorze antracytowym.Z bezpiecznym karabiñczykiem.D³ugoœæ: 2 mKolor: black-white-lightolive / czarny-bia³y-oliwkowy jasny					1				0							55.00	Dla konia > Kantary, uwi¹zy > Uwi¹zy			https://static3.redcart.pl/templates/images/thumb/22951/1500/1500/pl/0/templates/images/products/22951/2e90be6c504b8fb9ce33acce171ff1ab.png																
	simple		Uwi¹z PANIC - Reflexx S/S 21 - Eskadron - pink-white-black	1	0	visible		Uwi¹z PANIC - Reflexx S/S 21 - EskadronWykonany z mocnej, trzykolorowej linki polipropylenowej.Okucia w kolorze antracytowym.Z bezpiecznym karabiñczykiem.D³ugoœæ: 2 mKolor: pink-white-black / ró¿owy intensywny-bia³y-czarny					1				0							55.00	Dla konia > Kantary, uwi¹zy > Uwi¹zy			https://static3.redcart.pl/templates/images/thumb/22951/1500/1500/pl/0/templates/images/products/22951/c820af6d5f65feac3952a849deb6bde6.png																
	simple		Uwi¹z SWIVEL - Reflexx S/S 21 - Eskadron - black-white-lightolive	1	0	visible		Uwi¹z SWIVEL - Reflexx S/S 21 - EskadronWykonany z mocnej, trzykolorowej linki polipropylenowej.Okucia w kolorze antracytowym.Ze zwyk³ym karabiñczykiem.D³ugoœæ: 2 mKolor: black-white-lightolive / czarny-bia³y-oliwkowy jasny					1				0							55.00	Dla konia > Kantary, uwi¹zy > Uwi¹zy			https://static4.redcart.pl/templates/images/thumb/22951/1500/1500/pl/0/templates/images/products/22951/3681eed6432a8b6c72a2abb405eff865.png																
	simple		Kaloszki gumowe RUBBER ROUND - Eskadron - black	1	0	visible		Kaloszki wykonane z wytrzyma³ej gumy. Chroni¹ nogi konia przed uderzeniami i kontuzjami. S¹ odporne na rozdarcia i ³atwe w czyszczeniu. Sprzedawane w parach! Idealne do trudnego terenu i crossu!Kolor: czarny 					1				0							55.00	Dla konia > Ochraniacze, kaloszki, owijki i podk³adki > Kaloszki			https://static4.redcart.pl/templates/images/thumb/22951/1500/1500/pl/0/templates/images/products/22951/a85fcad0520290795022e6cd5b379cb5.jpg																
	simple		Kaloszki gumowe RUBBER ROUND - Eskadron - white	1	0	visible		Kaloszki wykonane z wytrzyma³ej gumy. Chroni¹ nogi konia przed uderzeniami i kontuzjami. S¹ odporne na rozdarcia i ³atwe w czyszczeniu. Sprzedawane w parach! Idealne do trudnego terenu i crossu!Kolor: bia³y					1				0							55.00	Dla konia > Ochraniacze, kaloszki, owijki i podk³adki > Kaloszki			https://static4.redcart.pl/templates/images/thumb/22951/1500/1500/pl/0/templates/images/products/22951/a538d0196eb674db321f00f0d9dea532.jpg																
	simple		Opaska na g³owê - Reflexx Equestrian Fanatics S/S 21 - Eskadron - pink	1	0	visible		"Opaska na g³owê - Reflexx Equestrian Fanatics S/S 21 - Eskadron - pinkWykonana z technicznego d¿erseju.Posiada otwór na kitkê.Napis 3d ""Eskadron"".Rozmiar: ONE SIZEKolor: pink - ró¿owy intensywny"					1				0							55.00	Dla jeŸdŸca > Odzie¿ jeŸdziecka > Czapki, czapeczki, szaliki			https://static4.redcart.pl/templates/images/thumb/22951/1500/1500/pl/0/templates/images/products/22951/0f54c953999e6c73cb3a45a14d018adb.png																
	simple		Opaska na g³owê - Reflexx Equestrian Fanatics S/S 21 - Eskadron - lightolive	1	0	visible		"Opaska na g³owê - Reflexx Equestrian Fanatics S/S 21 - EskadronWykonana z technicznego d¿erseju.Posiada otwór na kitkê.Napis 3d ""Eskadron"".Rozmiar: ONE SIZEKolor: lightolive - oliwkowy jasny"					1				0							55.00	Dla jeŸdŸca > Odzie¿ jeŸdziecka > Czapki, czapeczki, szaliki			https://static5.redcart.pl/templates/images/thumb/22951/1500/1500/pl/0/templates/images/products/22951/f5a20e80e96ce3181d4944266af3df03.png																
	simple		Uwi¹z REGULAR PH - Classic Sports A/W 21 - Eskadron - steel grey	1	0	visible		Uwi¹z REGULAR PH - Classic Sports A/W 21 - Eskadron - steel greyPleciony uwi¹z wykonany z linki polipropylenowej.Z bezpiecznym karabiñczykiem.D³ugoœæ: ok. 2mKolor: steel grey - szary					1				0							55.00	Dla konia > Kantary, uwi¹zy > Uwi¹zy			https://static2.redcart.pl/templates/images/thumb/22951/1500/1500/pl/0/templates/images/products/22951/77349a967a36e268bc3f33a63a772258.png																
	simple		Uwi¹z REGULAR PH - Classic Sports A/W 21 - Eskadron - dark navy	1	0	visible		Uwi¹z REGULAR PH - Classic Sports A/W 21 - Eskadron - dark navyPleciony uwi¹z wykonany z linki polipropylenowej.Z bezpiecznym karabiñczykiem.D³ugoœæ: ok. 2mKolor: dark navy - granatowy					1				0							55.00	Dla konia > Kantary, uwi¹zy > Uwi¹zy			https://static1.redcart.pl/templates/images/thumb/22951/1500/1500/pl/0/templates/images/products/22951/9491baa0aaca69d47192098eae089924.png																
	simple		Uwi¹z REGULAR PH - Classic Sports A/W 21 - Eskadron - vintage gold	1	0	visible		Uwi¹z REGULAR PH - Classic Sports A/W 21 - Eskadron - vintage goldPleciony uwi¹z wykonany z linki polipropylenowej.Z bezpiecznym karabiñczykiem.D³ugoœæ: ok. 2mKolor: vintage gold - ¿ó³ty					1				0							55.00	Dla konia > Kantary, uwi¹zy > Uwi¹zy			https://static4.redcart.pl/templates/images/thumb/22951/1500/1500/pl/0/templates/images/products/22951/88447d299ac48c8fcb1c69212584745f.png																
	simple		Uwi¹z REGULAR KH - Classic Sports A/W 21 - Eskadron - steel grey	1	0	visible		Uwi¹z REGULAR KH - Classic Sports A/W 21 - Eskadron - steel greyPleciony uwi¹z wykonany z linki polipropylenowej.Ze zwyk³ym karabiñczykiem.D³ugoœæ: ok. 2mKolor: steel grey - szary					1				0							55.00	Dla konia > Kantary, uwi¹zy > Uwi¹zy			https://static3.redcart.pl/templates/images/thumb/22951/1500/1500/pl/0/templates/images/products/22951/48278c86e3e96d764192ca7c083022c9.png																
	simple		Uwi¹z REGULAR KH - Heritage AW 2021/22 - Eskadron - antique green/sea salt/plaza taupe	1	0	visible		Uwi¹z REGULAR KH - Heritage AW 2021/22 - EskadronWykonany z elastycznej, plecionej, kolorowej linki polipropylenowej.Okucia metalowe w kolorze szczotkowanego z³ota.Karabiñczyk: zwyk³yD³ugoœæ: ok. 2mKolor: antique green/sea salt/plaza taupe - zielony ciemny/miêtowy jasny/taupe (szarobr¹zowy)					1				0							55.00	Dla konia > Kantary, uwi¹zy > Uwi¹zy			https://static3.redcart.pl/templates/images/thumb/22951/1500/1500/pl/0/templates/images/products/22951/0cd456cde6ecf5d664625df5d4a7db81.png																
	simple		Uwi¹z REGULAR PH Black Week Exclusive - Eskadron - black	1	0	visible		Uwi¹z REGULAR PH Black Week Exclusive - Eskadron - blackPleciony uwi¹z, wykonany z mocnej linki ozdobionej b³yszcz¹c¹ nici¹.Karabiñczyk: bezpiecznyKolor: black - czarny					1				0							58.00	Dla konia > Kantary, uwi¹zy > Uwi¹zy			https://static4.redcart.pl/templates/images/thumb/22951/1500/1500/pl/0/templates/images/products/22951/c5dc4a427fcf18abea48c17e2b272e4f.png																
	simple		Uwi¹z REGULAR KH Black Week Exclusive - Eskadron - black	1	0	visible		Uwi¹z REGULAR KH Black Week Exclusive - Eskadron - blackPleciony uwi¹z, wykonany z mocnej linki ozdobionej b³yszcz¹c¹ nici¹.Karabiñczyk: zwyk³yKolor: black - czarny					1				0							58.00	Dla konia > Kantary, uwi¹zy > Uwi¹zy			https://static4.redcart.pl/templates/images/thumb/22951/1500/1500/pl/0/templates/images/products/22951/8aba1036d7cff9435e0f9a738c5b531f.png																
	simple		Preparat do szybkiego usuwania plam na sucho SPOT OFF 500ml - Eskadron	1	0	visible		"Spot off Clean - czyœci ""na sucho""Szybki i wygodny spray do czyszczenia koni, zw³aszcza tych o jasnej sierœci.Usuwa brud oraz trudne do umycia plamy na sierœci oraz grzywie i ogonie.Zapobiega ponownemu osadzaniu siê brudu.Niezbêdny zim¹ kiedy nie ma mo¿liwoœci wyk¹pania czy umycia konia !!!Opakowanie - plastikowa butelka ze spryskiwaczem.Pojemnoœæ: 500ml"					1				0							59.00	Dla konia > Pielêgnacja konia - preparaty > Do sierœci, grzywy i ogona			https://static1.redcart.pl/templates/images/thumb/22951/1500/1500/pl/0/templates/images/products/22951/5a20c2b1c15f99f90b33646a4c2e713e.jpg																
	simple		Uwi¹z DURALASTIC SWIVEL - Reflexx S/S 21 - Eskadron - lightolive	1	0	visible		Uwi¹z DURALASTIC SWIVEL - Reflexx S/S 21 - EskadronWykonany z mocnej linki polipropylenowej.Okucia w kolorze antracytowym.Ze zwyk³ym karabiñczykiem.D³ugoœæ: 2 mKolor: light olive - oliwkowy jasny					1				0							59.00	Dla konia > Kantary, uwi¹zy > Uwi¹zy			https://static4.redcart.pl/templates/images/thumb/22951/1500/1500/pl/0/templates/images/products/22951/288a26491d2774ab6a7168111c3d5fe8.png																
	simple		Uwi¹z DURALASTIC PANIC - Reflexx S/S 21 - Eskadron - lightolive	1	0	visible		Uwi¹z DURALASTIC PANIC - Reflexx S/S 21 - EskadronWykonany z mocnej linki polipropylenowej.Okucia w kolorze antracytowym.Z bezpiecznym karabiñczykiem.D³ugoœæ: 2 mKolor: light olive - oliwkowy jasny					1				0							59.00	Dla konia > Kantary, uwi¹zy > Uwi¹zy			https://static2.redcart.pl/templates/images/thumb/22951/1500/1500/pl/0/templates/images/products/22951/70e80811c12046ede11380937b95063c.png																
