	simple		Podk³adki pod banda¿e CLIMALEGS - PLATINUM EDITION 2020/21 - Eskadron - greige	1	0	visible		Podk³adki pod banda¿e CLIMALEGS - PLATINUM EDITION 2020/21 - EskadronPosiadaj¹ dodatkowe wzmocnienie w miejscu pêciny.Pokryte z zewn¹trz oddychaj¹c¹ oraz elastyczn¹ siateczk¹ MESH.Zapinane na mocny rzep.Œwietnie odprowadzaj¹ wilgoæ na zewn¹trz.Cena za parê.Kolor: greige					1				0							125.00	Dla konia > Ochraniacze, kaloszki, owijki i podk³adki > Podk³adki pod owijki			https://static2.redcart.pl/templates/images/thumb/22951/1500/1500/pl/0/templates/images/products/22951/e7cdead87021f1b7359e278d55936e9b.png																
	simple		Podk³adki pod banda¿e CLIMALEGS - PLATINUM EDITION 2020/21 - Eskadron - havanabrown	1	0	visible		Podk³adki pod banda¿e CLIMALEGS - PLATINUM EDITION 2020/21 - EskadronPosiadaj¹ dodatkowe wzmocnienie w miejscu pêciny.Pokryte z zewn¹trz oddychaj¹c¹ oraz elastyczn¹ siateczk¹ MESH.Zapinane na mocny rzep.Œwietnie odprowadzaj¹ wilgoæ na zewn¹trz.Cena za parê.Kolor: havanabrown					1				0							125.00	Dla konia > Ochraniacze, kaloszki, owijki i podk³adki > Podk³adki pod owijki			https://static5.redcart.pl/templates/images/thumb/22951/1500/1500/pl/0/templates/images/products/22951/3f8a7b5c6d44d142f259bbfea60c9dea.png																
	simple		Kantar PIN BUCKLE STANDARD - Eskadron - blackberry	1	0	visible		Kantar PIN BUCKLE STANDARD - EskadronWykonany z mocnej taœmy nylonowej.Nachrapnik obszyty ozdobn¹ taœm¹ z logo firmy.Miêkko podszyty na potylicy oraz na nosie.Zapinany na zwyk³y karabiñczyk.Regulowany na pasku potylicznym oraz na nachrapniku.Kolor: blackberry					1				0							125.00	Dla konia > Kantary, uwi¹zy > Kantary			https://static1.redcart.pl/templates/images/thumb/22951/1500/1500/pl/0/templates/images/products/22951/cee4c0d0ed9477424723ceec09311da0.jpg																
	simple		Kantar PIN BUCKLE STANDARD - Eskadron - nightblue/white/blackberry	1	0	visible		Kantar PIN BUCKLE STANDARD - EskadronWykonany z mocnej taœmy nylonowej.Nachrapnik obszyty ozdobn¹ taœm¹ z logo firmy.Miêkko podszyty na potylicy oraz na nosie.Zapinany na zwyk³y karabiñczyk.Regulowany na pasku potylicznym oraz na nachrapniku za pomoc¹ klamry z bolcem.Okucia w kolorze srebrnym.Kolor: night blue/white/blackberry					1				0							125.00	Dla konia > Kantary, uwi¹zy > Kantary			https://static5.redcart.pl/templates/images/thumb/22951/1500/1500/pl/0/templates/images/products/22951/05c23fcb59da0eda0ee5e5ab2cb63975.jpg																
	simple		Kantar Eskadron PIN BUCKLE STANDARD - chili/white/nightblue	1	0	visible		Wykonany z nylonowej taœmy, z miêkkim podszyciem.Zapinany na przesuwn¹ sprz¹czkê z bolcem.Kolor: chili/white/nightblue - czerwony/bia³y/granatowy					1				0							125.00	Dla konia > Kantary, uwi¹zy > Kantary			https://static4.redcart.pl/templates/images/thumb/22951/1500/1500/pl/0/templates/images/products/22951/6ff9467562a059c08198674640085675.jpg																
	simple		Koszulka oversize LULU ESKADRON Equestrian Fanatics - denim striped	1	0	visible		"ESKADRON wytycza nowe horyzonty!Po raz pierwszy najpopularniejsza linia wyznaczaj¹ca koñskie trendy stworzy³a liniê odzie¿y ""ESKADRON EQUESTRIAN FANATICS"".Koszulka bawe³niana oversize dla mi³oœniczek luŸniejszych koszulek.Œwietna nie tylko dla mi³oœników Eskadron - sprawdzi siê podczas noszenia w stajni jak i na co dzieñ ;-)Kolor: denim striped (granatowo-bia³e paski)Rozmiary:XSSM"					1				0							149.00	Dla jeŸdŸca > Odzie¿ jeŸdziecka > Koszule, bluzki, T-shirty			https://static2.redcart.pl/templates/images/thumb/22951/1500/1500/pl/0/templates/images/products/22951/35de4db60df5f08be36644a1fc36ad7a.jpg																
	simple		Ochraniacze ty³y - Eskadron - stare logo	1	0	visible		Ochraniacze ty³y - EskadronZapinane na mocny rzep.Wyœcie³ane w œrodku miêkkim neoprenem.Rozmiar: FULL					1				0							129.00	Dla konia > Ochraniacze, kaloszki, owijki i podk³adki > Ochraniacze TY£Y			https://static1.redcart.pl/templates/images/thumb/22951/1500/1500/pl/0/templates/images/products/22951/36d61bc60a3980c27ced6db07fab4408.jpg																
	simple		Podk³adki pod banda¿e CLIMALEGS Eskadron Classic Sports wiosna-lato 2020 - skyblue	1	0	visible		Podk³adki pod banda¿e CLIMALEGS Eskadron Classic Sports 2020 - skybluePiankowe podk³adki podszyte materia³em frotte przyjaznym dla skóry.Zewnêtrzna czêœæ perforowana dla lepszego ruchu powietrza.Zapinane na rzep.Sprzedawane w parach.Wymiary:45x35cm - rozmiar M45x45cm - rozmiar LKolor: skyblueEdycja limitowana!!					1				0							129.00	Dla konia > Ochraniacze, kaloszki, owijki i podk³adki > Podk³adki pod owijki			https://static4.redcart.pl/templates/images/thumb/22951/1500/1500/pl/0/templates/images/products/22951/13326c92055f7d7396c44f26f3d6be0d.png																
	simple		Kantar Eskadron PIN BUCKLE GLOSSY PRINTED Reflexx wiosna/lato 2020 - navy	1	0	visible		Kantar Eskadron PIN BUCKLE GLOSSY PRINTED Reflexx wiosna/lato 2020 - navyMiêkko podszyty w czêœci nosowej oraz potylicznej. Ze srebrnymi okuciami. Posiada podwójn¹ regulacje, dziêki czemu mo¿emy go idealnie dopasowaæ do g³owy konia. Kolor: navy					1				0							129.00	Dla konia > Kantary, uwi¹zy > Kantary			https://static2.redcart.pl/templates/images/thumb/22951/1500/1500/pl/0/templates/images/products/22951/6eb4357964f0a49e5cee0dffc0cc8a82.png																
	simple		Kantar Eskadron PIN BUCKLE GLOSSY Reflexx wiosna/lato 2020 - neon	1	0	visible		Kantar Eskadron PIN BUCKLE GLOSSY Reflexx wiosna/lato 2020 - neonMiêkko podszyty w czêœci nosowej oraz potylicznej.Ze srebrnymi okuciami. Posiada podwójn¹ regulacje, dziêki czemu mo¿emy go idealnie dopasowaæ do g³owy konia. Kolor: neon					1				0							129.00	Dla konia > Kantary, uwi¹zy > Kantary			https://static2.redcart.pl/templates/images/thumb/22951/1500/1500/pl/0/templates/images/products/22951/a230ed7e36a04ad8dba0163e06a3b9ff.png																
	simple		Maska przeciwko owadom DynAirMesh Reflexx wiosna/lato 2020 - grey	1	0	visible		Maska przeciwko owadom DynAirMesh Reflexx wiosna/lato 2020 - greySiatkowa maska z nausznikami, zapinana na dwa szerokie rzepy. Materia³ na uszach jest miêkki i elastyczny. Produkt zapewnia wygodê i maksymaln¹ ochronê przed owadami.Kolor: grey					1				0							129.00	Dla konia > Nauszniki, frêdzelki, moskitiery > Moskitiery, frêdzelki			https://static1.redcart.pl/templates/images/thumb/22951/1500/1500/pl/0/templates/images/products/22951/ba607b9719ad3c6833ba449a70a9c593.png																
	simple		Czapka z daszkiem Eskadron MESH Reflexx wiosna/lato 2020 - navy	1	0	visible		Czapka z daszkiem Eskadron MESH Reflexx wiosna/lato 2020 - navyBezstopniowa regulacja.Wykonana z wodoodpornego materia³u.Z t³oczonym logo firmy.Kolor: navy					1				0							129.00	Dla jeŸdŸca > Odzie¿ jeŸdziecka > Czapki, czapeczki, szaliki > Czapki z daszkiem			https://static5.redcart.pl/templates/images/thumb/22951/1500/1500/pl/0/templates/images/products/22951/704202f9c2ea1122cd977267bcfd7c03.png																
	simple		Nauszniki Eskadron DynAirMesh Reflexx wiosna/lato 2020 - navy	1	0	visible		Nauszniki Eskadron DynAirMesh Reflexx wiosna/lato 2020 - navyObszyte sznurkiem w jednolitym kolorze.Z wyt³oczonym logo firmy na œrodku.Materia³ DynAirMesh, który zapewnia optymaln¹ cyrkulacje powietrza. Kolor: navy					1				0							129.00	Dla konia > Nauszniki, frêdzelki, moskitiery > Nauszniki			https://static4.redcart.pl/templates/images/thumb/22951/1500/1500/pl/0/templates/images/products/22951/f10cabc088bc84ea9db5ab00ea529148.png																
	simple		Nauszniki SPORT Standard - Eskadron - dark brown	1	0	visible		Nauszniki SPORT Standard - EskadronKlasyczne nauszniki wykonane z wysokiej jakoœci materia³ów.Elastyczny materia³ na uszach.Kolor: dark brown					1				0							129.00	Dla konia > Nauszniki, frêdzelki, moskitiery > Nauszniki			https://static2.redcart.pl/templates/images/thumb/22951/1500/1500/pl/0/templates/images/products/22951/6d8366401150b2ab9523d53e8e1d8c4d.jpg																
	simple		Banda¿e polarowe Eskadron Heritage 2019/20 - black mocca	1	0	visible		Miêkkie, niemechac¹ce siê i nierozci¹gaj¹ce siê owijki polarowe.Zapinane na mocne rzepy z ozdobnym znaczkiem kolekcyjnym.Rozmiar:PONY (d³ugoœæ: 2,8m, szerokoœæ: 9cm)FULL (d³ugoœæ: 3,5m, szerokoœæ: 11cm)Kolor: black mocca					1				0							130.00	Dla konia > Ochraniacze, kaloszki, owijki i podk³adki > Banda¿e, owijki			https://static1.redcart.pl/templates/images/thumb/22951/1500/1500/pl/0/templates/images/products/22951/da7ff84066b02663187fffc930c835ad.png																
	simple		Banda¿e polarowe Eskadron Heritage 2019/20 - oxfordnavy	1	0	visible		Miêkkie, niemechac¹ce siê i nierozci¹gaj¹ce siê owijki polarowe.Zapinane na mocne rzepy z ozdobnym znaczkiem kolekcyjnym.Rozmiar:PONY (d³ugoœæ: 2,8m, szerokoœæ: 9cm)FULL (d³ugoœæ: 3,5m, szerokoœæ: 11cm)Kolor: oxfordnavy					1				0							130.00	Dla konia > Ochraniacze, kaloszki, owijki i podk³adki > Banda¿e, owijki			https://static3.redcart.pl/templates/images/thumb/22951/1500/1500/pl/0/templates/images/products/22951/d5958e35299d25dc8b531c8818fb60ba.png																
	simple		Kantar Eskadron FauxFur NEW GENERATION 2018 - inkblue	1	0	visible		Kolor: inkblue (granatowy)Rozmiar:Pony (P2)Cob (V)Full (W)ExtraFull (WE)Kantar wykonany z nylonowej taœmy obszytej lekko po³yskuj¹cym materia³em.Starannie wykoñczony.Obwód nachrapnika oraz pasek potyliczny regulowany za pomoc¹ klamry z bolcem.Na potylicy, nachrapniku i paskach policzkowych podszyty sztucznym misiem dla zwiêkszenia komfortu.Futerko mo¿na swobodnie odpi¹æ do prania.Idealny dla wra¿liwych koni z tendencj¹ do otaræ na pysku.					1				0							165.00	Dla konia > Kantary, uwi¹zy > Kantary			https://static4.redcart.pl/templates/images/thumb/22951/1500/1500/pl/0/templates/images/products/22951/c4c68b63b43eefb861ab04335cf46068.jpg																
	simple		Koszulka z d³ugim rêkawem DANA damska Eskadron Equestrian Fanatics jesieñ-zima 2018/19 - dark navy	1	0	visible		Koszulka dopasowana do cia³a z d³ugim rêkawem.Ekstrawagancki wzór z has³em Eskadron na pewno przyci¹gnie wzrok!Kolor: ciemny granatRozmiar: XS, S, M, L					1				0							165.00	Kolekcje > ESKADRON Kolekcje > ESKADRON EQUESTRIAN FANATICS - FASHION AW 2018/201			https://static1.redcart.pl/templates/images/thumb/22951/1500/1500/pl/0/templates/images/products/22951/0408c9e051c9eecb3b08f786b0ed7bc7.jpg																
	simple		Koszulka damska NALA II Equestrian Fanatics SS20 - ESKADRON - navy	1	0	visible		"Koszulka damska NALA II Equestrian Fanatics SS20 - ESKADRONSprawdzi siê podczas noszenia w stajni jak i na co dzieñ.Klasyczny t-shirt z po³yskuj¹cym napisem ""Eskadron"".Elastyczny oraz oddychaj¹cy materia³.Materia³: 94% bawe³na, 6% elastanKolor: navy"					1				0							132.00	Dla jeŸdŸca > Odzie¿ jeŸdziecka > Koszule, bluzki, T-shirty			https://static1.redcart.pl/templates/images/thumb/22951/1500/1500/pl/0/templates/images/products/22951/74414110abfcb846fc58b9f5fc42b00c.jpg																
	simple		Potnik Cotton SPORTS SELECTION Eskadron - PONY - chili	1	0	visible		Klasyczny, drobno pikowany potnik firmy Eskadron z kontrastow¹ lamówk¹.Nadaje siê zarówno na konkursy jak i do codziennej pracy.Doskonale odprowadza pot i szybko wysycha. Dobrze uk³ada siê pod siod³em. Materia³KolorRozmiar Zastosowanie100% bawe³nachili red (czerwony)PONY uje¿d¿eniowy (PD), wszechstronny (P)					1				0							135.00	Dla konia > Potniki, podk³adki pod siod³o > Czapraki, potniki			https://static1.redcart.pl/templates/images/thumb/22951/1500/1500/pl/0/templates/images/products/22951/1cf9195fbbf7d36775985ae7d5580f2e.jpg																
	simple		Potnik Eskadron COTTON - CLASSIC SPORTS - jesieñ-zima 2019/2020 - softgrey	1	0	visible		Potnik Eskadron COTTON z kolekcji CLASSIC SPORTS - jesieñ-zima 2019/2020.Wykonany z wysokiej jakoœci materia³ów, doskonale odprowadzaj¹cych pot. Dziêki swojemu wyprofilowaniu dobrze uk³ada siê na grzbiecie i pod siod³em. Posiada zawleczkê na poprêg i paski do przystu³. Dodatkowo ozdobiony lamówk¹ w kontrastowym kolorze. uje¿dzeniowy (DL)wszechstronny (VS)skokowy (SR)Rozmiar: FULLKolor: softgrey					1				0							135.00	Dla konia > Potniki, podk³adki pod siod³o > Czapraki, potniki			https://static2.redcart.pl/templates/images/thumb/22951/1500/1500/pl/0/templates/images/products/22951/18b2b526546f0ec9f43ecabb7e6ec799.png																
	simple		Nauszniki DynAirMesh - PLATINUM PURE SS 20 - ESKADRON - black	1	0	visible		Nauszniki DynAirMesh - PLATINUM PURE wiosna-lato 2020 - ESKADRONWykonane z wysoce elastycznego oraz oddychaj¹cego materia³u - DynAirMesh.Obszyte dooko³a b³yszcz¹cym sznureczkiem lureksowym.Ozdobione logiem kolekcji.Kolor: blackEdycja limitowana!					1				0							135.00	Dla konia > Nauszniki, frêdzelki, moskitiery > Nauszniki			https://static1.redcart.pl/templates/images/thumb/22951/1500/1500/pl/0/templates/images/products/22951/e8bd8e84a0f09a4066e2b35b0c41fdb4.jpg																
	simple		Maska przeciwko owadom DynAirMesh PLATINUM EDITION 2020/21 - Eskadron - havanabrown	1	0	visible		Maska przeciwko owadom DynAirMesh PLATINUM EDITION 2020/21 - Eskadron Innowacyjna maska zabezpieczaj¹ca konie przed irytuj¹cymi owadami i insektami. Wykonana z oddychaj¹cego, elastycznego materia³u DynAirMesh. Zapewnia swobodê ruchów, nie sprawia dyskomfortu nawet w okolicach uszu. Ciemna siatka na oczach zabezpiecza przed s³oñcem. Od wewnêtrznej strony wy³o¿ona miêkkim materia³em, który zapobiega obcieraniu. Kolor: havanabrown					1				0							135.00	Dla konia > Nauszniki, frêdzelki, moskitiery > Moskitiery, frêdzelki			https://static3.redcart.pl/templates/images/thumb/22951/1500/1500/pl/0/templates/images/products/22951/cd5138bec3116007595eb87f6a0b40e6.png																
	simple		Kantar STRIPED - CLASSIC SPORTS wiosna-lato 2021 - Eskadron - navy/cream/tendertaupe 	1	0	visible		Kantar STRIPED - CLASSIC SPORTS wiosna-lato 2021 - EskadronWykonany z mocnej, nylonowej taœmy.Miêkko podszyty na potylicy oraz na nosie.Zapinany na karabiñczyk.Regulowany w czêœci potylicznej oraz nosowej za pomoc¹ klamry z bolcem.Kolor: navy/cream/tendertaupe					1				0							135.00	Dla konia > Kantary, uwi¹zy > Kantary			https://static2.redcart.pl/templates/images/thumb/22951/1500/1500/pl/0/templates/images/products/22951/7726a292e2fccfa4dcc95ff916fc7d52.png																
	simple		Kantar STRIPED - CLASSIC SPORTS wiosna-lato 2021 - Eskadron - rouge/cream/tendertaupe	1	0	visible		Kantar STRIPED - CLASSIC SPORTS wiosna-lato 2021 - EskadronWykonany z mocnej, nylonowej taœmy.Miêkko podszyty na potylicy oraz na nosie.Zapinany na karabiñczyk.Regulowany w czêœci potylicznej oraz nosowej za pomoc¹ klamry z bolcem.Kolor: rouge/cream/tendertaupe					1				0							135.00	Dla konia > Kantary, uwi¹zy > Kantary			https://static4.redcart.pl/templates/images/thumb/22951/1500/1500/pl/0/templates/images/products/22951/a1971c21f806d229b89f637aaa0c60f0.png																
	simple		Kantar STRIPED - CLASSIC SPORTS wiosna-lato 2021 - Eskadron - balsamgreen/cream/tendertaupe	1	0	visible		Kantar STRIPED - CLASSIC SPORTS wiosna-lato 2021 - EskadronWykonany z mocnej, nylonowej taœmy.Miêkko podszyty na potylicy oraz na nosie.Zapinany na karabiñczyk.Regulowany w czêœci potylicznej oraz nosowej za pomoc¹ klamry z bolcem.Kolor: balsamgreen/cream/tendertaupe					1				0							135.00	Dla konia > Kantary, uwi¹zy > Kantary			https://static5.redcart.pl/templates/images/thumb/22951/1500/1500/pl/0/templates/images/products/22951/f9ffe227d052ebd9be527317b5a9d098.png																
	simple		Nauszniki DynAirMesh - Reflexx S/S 21 - Eskadron - lightolive	1	0	visible		Nauszniki DynAirMesh - Reflexx S/S 21 - EskadronNowy, sportowy krój.W ca³oœci wykonane z oddychaj¹cej, szybkoschn¹cej siateczki DynAirMesh.Z przodu posiadaj¹ logo kolekcji.Kolor: lightolive - oliwkowy jasny					1				0							135.00	Dla konia > Nauszniki, frêdzelki, moskitiery > Nauszniki			https://static1.redcart.pl/templates/images/thumb/22951/1500/1500/pl/0/templates/images/products/22951/f6127ef1763883b467d76e327c3b4daa.png																
	simple		Nauszniki DynAirMesh - Reflexx S/S 21 - Eskadron - black	1	0	visible		Nauszniki DynAirMesh - Reflexx S/S 21 - EskadronNowy, sportowy krój.W ca³oœci wykonane z oddychaj¹cej, szybkoschn¹cej siateczki DynAirMesh.Z przodu posiadaj¹ logo kolekcji.Kolor: black - czarny					1				0							135.00	Dla konia > Nauszniki, frêdzelki, moskitiery > Nauszniki			https://static5.redcart.pl/templates/images/thumb/22951/1500/1500/pl/0/templates/images/products/22951/93aed6d2e4ef497837282d4b5b7fdb34.png																
	simple		Maska przeciw owiadom DynAirMesh - Reflexx S/S 21 - Eskadron - black	1	0	visible		Maska przeciw owiadom DynAirMesh - Reflexx S/S 21 - EskadronZapewnia wygodê i maksymaln¹ ochronê przed owadami.Wykonana z oddychaj¹cego, elastycznego materia³u DynAirMesh. Ciemna, drobna siatka na oczach zabezpiecza przed uporczywymi owadami oraz promieniami UV. Od wewnêtrznej strony wy³o¿ona miêkkim polarem, który zapobiega obcieraniu.Zapinana na mocne rzepy pod ganaszami.Kolor: black - czarny					1				0							135.00	Dla konia > Nauszniki, frêdzelki, moskitiery > Moskitiery, frêdzelki			https://static2.redcart.pl/templates/images/thumb/22951/1500/1500/pl/0/templates/images/products/22951/a9e41e47415d9616d12beeab25a3dd57.png																
	simple		Maska przeciw owiadom DynAirMesh - Reflexx S/S 21 - Eskadron - pink	1	0	visible		Maska przeciw owiadom DynAirMesh - Reflexx S/S 21 - EskadronZapewnia wygodê i maksymaln¹ ochronê przed owadami.Wykonana z oddychaj¹cego, elastycznego materia³u DynAirMesh. Ciemna, drobna siatka na oczach zabezpiecza przed uporczywymi owadami oraz promieniami UV. Od wewnêtrznej strony wy³o¿ona miêkkim polarem, który zapobiega obcieraniu.Zapinana na mocne rzepy pod ganaszami.Kolor: pink - ró¿owy intensywny					1				0							135.00	Dla konia > Nauszniki, frêdzelki, moskitiery > Moskitiery, frêdzelki			https://static5.redcart.pl/templates/images/thumb/22951/1500/1500/pl/0/templates/images/products/22951/2ad2af9665a0e1c1e0be356a545858f0.png																
	simple		Kantar PINBUCKLE - Reflexx S/S 21 - Eskadron - pink	1	0	visible		"Kantar PINBUCKLE - Reflexx S/S 21 - EskadronWykonany z wysokiej jakoœci, mocnej taœmy parcianej odpornej na rozdarcia.Miêkko podszyty na nosie oraz na potylicy.Posiada regulacje na pasku potylicznym oraz na nachrapniku za pomoc¹ klamry z bolcem.Nachrapnik ozdobiony silikonowym napisem ""Eskadron"".Mocne okucia w kolorze antracytowym.Kolor: pink - ró¿owy intensywny"					1				0							135.00	Dla konia > Kantary, uwi¹zy > Kantary			https://static4.redcart.pl/templates/images/thumb/22951/1500/1500/pl/0/templates/images/products/22951/dc07127935e2ec990bf20cdd3382395b.png																
	simple		Kantar PINBUCKLE - Reflexx S/S 21 - Eskadron - black	1	0	visible		"Kantar PINBUCKLE - Reflexx S/S 21 - EskadronWykonany z wysokiej jakoœci, mocnej taœmy parcianej odpornej na rozdarcia.Miêkko podszyty na nosie oraz na potylicy.Posiada regulacje na pasku potylicznym oraz na nachrapniku za pomoc¹ klamry z bolcem.Nachrapnik ozdobiony silikonowym napisem ""Eskadron"".Mocne okucia w kolorze antracytowym.Kolor: black - czarny"					1				0							135.00	Dla konia > Kantary, uwi¹zy > Kantary			https://static5.redcart.pl/templates/images/thumb/22951/1500/1500/pl/0/templates/images/products/22951/d9e19d8b6e72d682d7f299678677581b.png																
	simple		Kantar PINBUCKLE - Reflexx S/S 21 - Eskadron - lightolive	1	0	visible		"Kantar PINBUCKLE - Reflexx S/S 21 - EskadronWykonany z wysokiej jakoœci, mocnej taœmy parcianej odpornej na rozdarcia.Miêkko podszyty na nosie oraz na potylicy.Posiada regulacje na pasku potylicznym oraz na nachrapniku za pomoc¹ klamry z bolcem.Nachrapnik ozdobiony silikonowym napisem ""Eskadron"".Mocne okucia w kolorze antracytowym.Kolor: lightolive - oliwkowy jasny"					1				0							135.00	Dla konia > Kantary, uwi¹zy > Kantary			https://static4.redcart.pl/templates/images/thumb/22951/1500/1500/pl/0/templates/images/products/22951/e7ec95890e87cb12a1d24adfb12b2f75.png																
	simple		Kaloszki SOFTSLATE - Reflexx S/S 21 - Eskadron - lightolive	1	0	visible		Kaloszki SOFTSLATE - Reflexx S/S 21 - EskadronWykonane z innowacyjnego, wytrzyma³ego materia³u Softslate.Zapinane za pomoc¹ mocnego rzepa.Od wewnêtrznej strony podszyte miêkkim neoprenem absorbuj¹cym uderzenia.£atwe w utrzymaniu czystoœci.Cena za parê.Kolor: lightolive - oliwkowy jasny					1				0							135.00	Dla konia > Ochraniacze, kaloszki, owijki i podk³adki > Kaloszki			https://static4.redcart.pl/templates/images/thumb/22951/1500/1500/pl/0/templates/images/products/22951/8edb5943312fffca4b13a64f3fd82edd.png																
	simple		Kaloszki SOFTSLATE - Reflexx S/S 21 - Eskadron - pink	1	0	visible		Kaloszki SOFTSLATE - Reflexx S/S 21 - EskadronWykonane z innowacyjnego, wytrzyma³ego materia³u Softslate.Zapinane za pomoc¹ mocnego rzepa.Od wewnêtrznej strony podszyte miêkkim neoprenem absorbuj¹cym uderzenia.£atwe w utrzymaniu czystoœci.Cena za parê.Kolor: pink - ró¿owy intensywny					1				0							135.00	Dla konia > Ochraniacze, kaloszki, owijki i podk³adki > Kaloszki			https://static4.redcart.pl/templates/images/thumb/22951/1500/1500/pl/0/templates/images/products/22951/efd29bad46ce7e29519200b0488e704e.png																
	simple		Ochraniacze ty³y Protection - ESKADRON - nowe logo	1	0	visible		Ochraniacze ty³y Protection - ESKADRON - nowe logoZewnêtrzna skorupa wykonana z mocnego tworzywa TPU.W œrodku wyœcie³ane miêkkim neoprenem, amortyzuj¹cym wstrz¹sy i uderzenia.Zapinane na mocne rzepy.£atwe w utrzymaniu czystoœci.Cena za parê na tylne nogi.Kolor:racinggreen - zielony ciemnyblackberry - je¿ynowyblack - czarny					1				0							135.00	Dla konia > Ochraniacze, kaloszki, owijki i podk³adki > Ochraniacze TY£Y			https://static5.redcart.pl/templates/images/thumb/22951/1500/1500/pl/0/templates/images/products/22951/f05af7bb19f65c479036904346aa9d87.jpg																
	simple		Nauszniki CRYSTAL - Classic Sports A/W 21 - Eskadron - steel grey	1	0	visible		Nauszniki CRYSTAL - Classic Sports A/W 21 - Eskadron - steel greyWykonane z bawe³nianej przêdzy.Elastyczny materia³ na uszach.Ozdobione dooko³a lureksowym sznureczkiem oraz kryszta³kami.Kolor: steel grey - szary					1				0							135.00	Dla konia > Nauszniki, frêdzelki, moskitiery > Nauszniki			https://static2.redcart.pl/templates/images/thumb/22951/1500/1500/pl/0/templates/images/products/22951/9ac2d1a6b95edb0f814fa2ee977d0fcf.png																
	simple		Nauszniki CRYSTAL - Classic Sports A/W 21 - Eskadron - dark navy	1	0	visible		Nauszniki CRYSTAL - Classic Sports A/W 21 - Eskadron - dark navyWykonane z bawe³nianej przêdzy.Elastyczny materia³ na uszach.Ozdobione dooko³a lureksowym sznureczkiem oraz kryszta³kami.Kolor: dark navy - granatowy					1				0							135.00	Dla konia > Nauszniki, frêdzelki, moskitiery > Nauszniki			https://static4.redcart.pl/templates/images/thumb/22951/1500/1500/pl/0/templates/images/products/22951/0e6a85780f05822a23655a7ad7ee946e.png																
	simple		Nauszniki SPORT - Classic Sports A/W 21 - Eskadron - dark navy	1	0	visible		Nauszniki SPORT - Classic Sports A/W 21 - Eskadron - dark navyNowy, sportowy krój.Wykonane z bawe³nianej przêdzy.Obszyte dooko³a po³yskuj¹cym, lureksowym sznureczkiem.Ozdobione naszywk¹ z logo kolekcji.Kolor: dark navy - granatowy 					1				0							135.00	Dla konia > Nauszniki, frêdzelki, moskitiery > Nauszniki			https://static4.redcart.pl/templates/images/thumb/22951/1500/1500/pl/0/templates/images/products/22951/7e002d95bafc55769669248c22d24b98.png																
	simple		Nauszniki SPORT - Classic Sports A/W 21 - Eskadron - rustic red	1	0	visible		Nauszniki SPORT - Classic Sports A/W 21 - Eskadron - rustic redNowy, sportowy krój.Wykonane z bawe³nianej przêdzy.Obszyte dooko³a po³yskuj¹cym, lureksowym sznureczkiem.Ozdobione naszywk¹ z logo kolekcji.Kolor: rustic red - winny					1				0							135.00	Dla konia > Nauszniki, frêdzelki, moskitiery > Nauszniki			https://static5.redcart.pl/templates/images/thumb/22951/1500/1500/pl/0/templates/images/products/22951/4835fc69e3998602d161b669454409b2.png																
	simple		Kantar PIN BUCKLE - Classic Sports A/W 21 - Eskadron - steel grey	1	0	visible		Kantar PIN BUCKLE - Classic Sports A/W 21 - Eskadron - steel greyWykonany z wysokiej jakoœci, mocnej taœmy parcianej.Regulowany w czêœci nosowej oraz potylicznej za pomoc¹ klamry z bolcem.Miêkko podszyty na policzkach, potylicy oraz na nachrapniku.Zapinany na karabiñczyk.Kolor: steel grey - szary					1				0							135.00	Dla konia > Kantary, uwi¹zy > Kantary			https://static1.redcart.pl/templates/images/thumb/22951/1500/1500/pl/0/templates/images/products/22951/3cccf1f2cc671d77fac9f0161dee7a71.png																
	simple		Kantar PIN BUCKLE - Classic Sports A/W 21 - Eskadron - dark navy	1	0	visible		Kantar PIN BUCKLE - Classic Sports A/W 21 - Eskadron - dark navyWykonany z wysokiej jakoœci, mocnej taœmy parcianej.Regulowany w czêœci nosowej oraz potylicznej za pomoc¹ klamry z bolcem.Miêkko podszyty na policzkach, potylicy oraz na nachrapniku.Zapinany na karabiñczyk.Kolor: dark navy - granatowy					1				0							135.00	Dla konia > Kantary, uwi¹zy > Kantary			https://static2.redcart.pl/templates/images/thumb/22951/1500/1500/pl/0/templates/images/products/22951/2ea78f422c03969ada9e43152403f841.png																
